{
  "artifact_type": "route_decision",
  "summary": "Route the bounded request to the planner without pretending solo execution owns the full loop.",
  "next_hop_kind": "tier",
  "next_hop": "planner",
  "reason": "The route only needs architectural triage before it should hand off to a fuller multi-role path."
}
